{
  "schema_version": "1.0",
  "promise_delivery": {
    "passed": true,
    "observation": "The reviewed output demonstrates the practical system named in the approved promise."
  },
  "proof_delivery": {
    "passed": true,
    "observation": "The selected mechanism and visible proof are present in the reviewed result."
  },
  "audience_relevance": {
    "passed": true,
    "observation": "The next step is useful to the approved solo-operator audience."
  },
  "failure_action": "Keep this passed evaluation with the candidate result; no content correction is requested."
}
